{
  "protocol_id": "proto_meal_photo_log_7d",
  "schema_version": "0.1.0",
  "title": "Meal photo log — 7 days",
  "version": "0.1.0",
  "domain_pack": "nutrition",
  "class": "habit_tracking",
  "hypothesis": "Photographing meals for 7 days will increase awareness of meal timing and protein-containing meals without requiring calorie obsession.",
  "intervention": {
    "summary": "Before eating main meals, take a simple photo and log time + whether the meal included a protein-containing food.",
    "steps": [
      "Photograph breakfast, lunch, dinner (snacks optional).",
      "Log local time and hunger 1-10.",
      "Mark protein-containing food present: yes/no (your definition; be consistent).",
      "Weekly: review patterns with steward or AI using redacted context only."
    ],
    "dose_descriptor": "photo + 20-second log per meal",
    "materials": ["phone camera"]
  },
  "timing": {
    "anchor": "with_meals",
    "frequency": "each main meal"
  },
  "duration": {
    "days": 7,
    "washout_days": 0,
    "min_adherence": 0.7
  },
  "measurement_plan": [
    {
      "metric": "meals_logged",
      "method": "photo",
      "cadence": "per meal"
    },
    {
      "metric": "protein_containing_meal",
      "method": "self_report",
      "cadence": "per meal"
    },
    {
      "metric": "hunger_before",
      "method": "scale_1_10",
      "cadence": "per meal"
    }
  ],
  "expected_effect": {
    "direction": "explore",
    "subjective_window_days": 7,
    "note": "Goal is visibility and accountability, not weight targets unless set with a clinician."
  },
  "stop_conditions": [
    "Logging triggers disordered-eating thoughts",
    "Clinician or therapist advises against food photography/tracking"
  ],
  "contraindications": [
    "Active eating disorder treatment where food logging is restricted",
    "Clinician-prescribed medical diet that forbids self-experiments"
  ],
  "claim_ids": ["claim_nutrition_protein_meals_pattern"],
  "evidence_floor": "expert_consensus",
  "jurisdiction_flags": ["none"],
  "safety": {
    "not_diagnosis": true,
    "not_prescription": true,
    "emergency_route": "For medical emergencies call local emergency services."
  },
  "last_reviewed": "2026-08-10"
}
