{
  "protocol_id": "proto_box_breath_5m",
  "schema_version": "0.1.0",
  "title": "Box breathing — 5 minutes",
  "version": "0.1.0",
  "domain_pack": "breath",
  "class": "ordinary_wellness",
  "hypothesis": "Five minutes of gentle box breathing once daily will reduce subjective stress scores over 14 days without dizziness or distress.",
  "intervention": {
    "summary": "Sit comfortably and breathe in a gentle 4-4-4-4 pattern for about five minutes.",
    "steps": [
      "Sit upright, soft gaze or eyes closed.",
      "Inhale gently ~4 counts, hold ~4, exhale ~4, hold ~4.",
      "Keep effort easy — never strain or gasp.",
      "Stop immediately if dizzy, chest pain, or panic increases.",
      "Log stress 1-10 before and after."
    ],
    "dose_descriptor": "5 minutes",
    "materials": ["optional timer"]
  },
  "timing": {
    "anchor": "as_needed_non_urgent",
    "frequency": "1x daily preferred",
    "phase_note": "Not for emergency panic or medical distress — use emergency services when needed."
  },
  "duration": {
    "days": 14,
    "washout_days": 0,
    "min_adherence": 0.6
  },
  "measurement_plan": [
    {
      "metric": "stress_before",
      "method": "scale_1_10",
      "cadence": "each session"
    },
    {
      "metric": "stress_after",
      "method": "scale_1_10",
      "cadence": "each session"
    }
  ],
  "expected_effect": {
    "direction": "reduce",
    "subjective_window_days": 3,
    "note": "Some people feel no change; that is valid data."
  },
  "stop_conditions": [
    "Dizziness, chest pain, fainting feeling",
    "Increased panic or dissociation",
    "Clinician advises against breath holds"
  ],
  "contraindications": [
    "Unstable heart or lung disease without clinician clearance",
    "Pregnancy complications where breath-hold practices were restricted",
    "Active panic attack requiring medical care"
  ],
  "claim_ids": ["claim_breath_slow_paced"],
  "evidence_floor": "expert_consensus",
  "jurisdiction_flags": ["none"],
  "safety": {
    "not_diagnosis": true,
    "not_prescription": true,
    "emergency_route": "Chest pain, trouble breathing, or suicidal crisis: emergency services / local crisis line."
  },
  "last_reviewed": "2026-08-10"
}
