{
  "protocol_id": "proto_morning_light_10m",
  "schema_version": "0.1.0",
  "title": "Morning outdoor light — 10 minutes",
  "version": "0.1.0",
  "domain_pack": "circadian",
  "class": "ordinary_wellness",
  "hypothesis": "Getting brief outdoor light within ~60 minutes of waking will subjectively improve morning alertness and make bedtime feel more natural over 14 days.",
  "intervention": {
    "summary": "Spend about 10 minutes outdoors after waking without sunglasses if safe for your eyes and environment.",
    "steps": [
      "Within about an hour of waking, go outdoors (balcony, street, garden).",
      "Stay ~10 minutes; overcast still counts.",
      "Do not stare at the sun.",
      "Log wake time, light session, and evening sleepiness (1-10)."
    ],
    "dose_descriptor": "10 minutes",
    "materials": ["optional timer", "optional walk"]
  },
  "timing": {
    "anchor": "upon_waking",
    "frequency": "daily",
    "phase_note": "Prefer natural daylight; if outdoor access is impossible, note barrier rather than forcing unsafe conditions."
  },
  "duration": {
    "days": 14,
    "washout_days": 0,
    "min_adherence": 0.7
  },
  "measurement_plan": [
    {
      "metric": "morning_alertness",
      "method": "scale_1_10",
      "cadence": "daily morning"
    },
    {
      "metric": "sleep_onset_ease",
      "method": "scale_1_10",
      "cadence": "daily evening"
    },
    {
      "metric": "wake_time_local",
      "method": "self_report",
      "cadence": "daily"
    }
  ],
  "expected_effect": {
    "direction": "improve",
    "subjective_window_days": 7,
    "note": "Effects are individual; stop if headache, eye pain, or mood worsens."
  },
  "stop_conditions": [
    "Eye pain, severe headache, or dizziness associated with the practice",
    "Clinician advises against bright-light exposure",
    "Outdoor conditions are unsafe"
  ],
  "contraindications": [
    "Photosensitizing medication or clinician-advised light restriction",
    "Active eye injury or post-eye-surgery restrictions",
    "Bipolar spectrum or light-sensitive conditions without clinician guidance"
  ],
  "claim_ids": ["claim_circadian_morning_light"],
  "evidence_floor": "expert_consensus",
  "jurisdiction_flags": ["none"],
  "safety": {
    "not_diagnosis": true,
    "not_prescription": true,
    "emergency_route": "For emergency symptoms call local emergency services.",
    "requires_clinician_clearance": false
  },
  "authors": ["BIOS packs"],
  "last_reviewed": "2026-08-10"
}
